{
  "$schema": "https://json-schema.org/draft/2020-12/schema",
  "$id": "gabagool.snapshot.v1",
  "title": "Exported snapshot",
  "description": "GABAGOOL_SNAPSHOT.json inside an exported snapshot, and levels/<slug>/builds/revision_<n>.export.json beside the design (the same record plus snapshot, where it went). Written by packages/service/exporting.py.",
  "type": "object",
  "required": ["schema", "design_id", "design_name", "design_revision", "mission_id", "layout", "package_fingerprint", "checklist", "exported_at"],
  "additionalProperties": false,
  "properties": {
    "schema": {"const": "gabagool.snapshot.v1"},
    "design_id": {"type": "string", "pattern": "^[0-9a-f]{32}$"},
    "design_name": {"type": "string", "minLength": 1},
    "design_revision": {"type": "integer", "minimum": 1},
    "mission_id": {"type": "string", "minLength": 1},
    "layout": {"type": "string", "minLength": 1, "description": "The candidate_id that was walked and exported."},
    "package_fingerprint": {"type": ["string", "null"], "description": "The export closure scan's fingerprint; null when the scan did not give one."},
    "checklist": {"type": "array", "minItems": 1, "items": {"$ref": "#/$defs/check"}},
    "exported_at": {"$ref": "#/$defs/local_time"},
    "snapshot": {"type": "string", "minLength": 1, "description": "Only in the record beside the design: the snapshot's folder."}
  },
  "$defs": {
    "local_time": {"type": "string", "pattern": "^[0-9]{4}-[0-9]{2}-[0-9]{2}T[0-9]{2}:[0-9]{2}:[0-9]{2}$"},
    "check": {
      "type": "object",
      "required": ["item", "state", "detail"],
      "additionalProperties": false,
      "properties": {
        "item": {"type": "string", "minLength": 1},
        "state": {"enum": ["ok", "problem", "unknown"], "description": "unknown when the file that would say is missing: never a pass."},
        "detail": {"type": "string"}
      }
    }
  }
}
